{
  "operation_id": "op_cleanup",
  "workspace_id": "example",
  "job_id": "job_example",
  "attempt_id": "att_original",
  "kind": "cleanup",
  "status": "succeeded",
  "revision": 3,
  "created_at": "2026-09-15T00:00:00Z",
  "updated_at": "2026-09-15T00:01:00Z",
  "effect": "remote_deleted",
  "remote_termination_confirmed": false,
  "replay": false,
  "problem": null,
  "links": {
    "self": "/v1/workspaces/example/operations/op_cleanup",
    "job": "/v1/workspaces/example/jobs/job_example"
  }
}
